{
  "id": "evt.mail.cleanup.2026-03-29T09:10:00Z",
  "ts": "2026-03-29T09:10:00Z",
  "class": "event",
  "type": "mail.cleanup.completed",
  "scope": "mail",
  "source": "runtime:mail-cleanup",
  "level": "info",
  "summary": "Mail cleanup completed",
  "refs": [
    "binder:mail"
  ],
  "data": {
    "archived": 22,
    "held": 6
  }
}
